{
  "schema_version": "1.0",
  "asset_id": "body-neutral-procedural-v1",
  "asset_version": "1.0.0",
  "variant": "default_neutral",
  "topology_id": "body-neutral-procedural-topology-v1",
  "release_status": "candidate",
  "source": {
    "author": "Body Companion project",
    "publisher": "Body Companion project",
    "source_url": "https://example.invalid/body-companion/procedural-candidate-v1",
    "obtained_at": "2026-08-08T01:34:00Z"
  },
  "rights": {
    "license_name": "Project-generated candidate; legal record pending",
    "license_url": "https://example.invalid/body-companion/procedural-candidate-v1/license",
    "commercial_use": false,
    "app_store_distribution": false,
    "modification_allowed": true,
    "derivative_distribution_allowed": false,
    "attribution_required": false
  },
  "integrity": {
    "source_sha256": "sha256:81171745e8813838376959e0910b2242c9bab422a42342c882ac8747ef5afe17",
    "manifest_sha256": "sha256:0000000000000000000000000000000000000000000000000000000000000000",
    "signature_status": "unverified",
    "signing_key_id": null
  },
  "coordinate_system": {
    "convention": "realitykit_y_up_right_handed",
    "unit": "meter",
    "root_origin": "feet_midpoint_ground_projection",
    "canonical_transform": [
      1, 0, 0, 0,
      0, 1, 0, 0,
      0, 0, 1, 0,
      0, 0, 0, 1
    ]
  },
  "artifacts": [
    {
      "artifact_id": "body-neutral-procedural-v1-render",
      "role": "render",
      "format": "usdz",
      "uri": "bundle://BodyNeutralPrototype.usdz",
      "sha256": "sha256:81171745e8813838376959e0910b2242c9bab422a42342c882ac8747ef5afe17",
      "required": true
    },
    {
      "artifact_id": "body-neutral-procedural-v1-runtime-collision-candidate",
      "role": "collision",
      "format": "usdz",
      "uri": "bundle://BodyNeutralPrototype.usdz",
      "sha256": "sha256:81171745e8813838376959e0910b2242c9bab422a42342c882ac8747ef5afe17",
      "required": true
    }
  ],
  "lods": [
    {
      "lod_id": "1.0.0",
      "render_artifact_id": "body-neutral-procedural-v1-render",
      "triangle_count": 3492,
      "surface_correspondence_version": "1.0.0"
    }
  ],
  "mappings": {
    "ontology_version": "body-ontology-prototype-v1",
    "region_map_version": "1.0.0",
    "surface_correspondence_version": "1.0.0",
    "resolver_version": "1.0.0"
  },
  "review": {
    "anatomy_status": "pending",
    "reviewer_alias": "unreviewed",
    "reviewed_at": null,
    "scope": "Visual location expression only; no anatomical or medical meaning."
  },
  "performance": {
    "status": "pending",
    "target_device_family": "iPhone 15 and later; not measured",
    "cold_start_ms": 0,
    "p95_hit_ms": 0,
    "minimum_fps": 0,
    "memory_mb": 0
  },
  "attribution": {
    "text": "",
    "placement": "not_required"
  },
  "fallback": {
    "fallback_kind": "body_map_2d",
    "fallback_asset_id": "body-map-2d-v1"
  },
  "created_at": "2026-08-08T01:34:00Z",
  "updated_at": "2026-08-08T01:40:00Z"
}
